page	timestamp	text
apply-for-a-postal-vote	2017-05-12T15:07:46.000+01:00	Updated postal vote form for England
apply-for-a-postal-vote	2016-04-26T16:05:45.000+01:00	Updated postal vote form
apply-for-a-postal-vote	2015-09-04T10:51:24.000+01:00	Added Welsh language form
apply-for-a-postal-vote	2015-03-09T15:13:31.000+00:00	Form updated.
apply-for-a-postal-vote	2014-06-10T00:15:00.000+01:00	First published.
proxy-voting-application-forms	2015-09-21T18:58:48.000+01:00	Welsh form added
proxy-voting-application-forms	2015-09-10T19:22:55.000+01:00	Added Welsh language forms
proxy-voting-application-forms	2015-03-09T15:13:07.000+00:00	Forms updated.
proxy-voting-application-forms	2014-06-10T00:15:00.000+01:00	First published.
application-for-a-vehicle-registration-certificate	2016-11-16T11:08:55.000+00:00	Added translation
application-for-a-vehicle-registration-certificate	2015-10-28T08:53:33.000+00:00	Latest version of V62 form added.
application-for-a-vehicle-registration-certificate	2014-10-01T14:03:10.000+01:00	Update version of the V62 form.
application-for-a-vehicle-registration-certificate	2014-01-20T13:51:35.000+00:00	Re-formatted the Welsh version due to customer feedback
application-for-a-vehicle-registration-certificate	2014-01-08T11:10:38.000+00:00	Re-formatted the form due to customer feedback
application-for-a-vehicle-registration-certificate	2013-07-01T14:07:29.000+01:00	New version of the form
application-for-a-vehicle-registration-certificate	2011-07-01T01:00:00.000+01:00	First published.
child-benefit-claim-form-ch2	2017-04-06T00:15:46.000+01:00	This guidance has been updated to reflect 2017 to 2018 forms with new tax year changes effective from 6 April 2017.
child-benefit-claim-form-ch2	2016-11-10T09:32:26.000+00:00	Address label (CH3) attached to bottom of Child Benefit claim form (CH2): print then complete pdf.
child-benefit-claim-form-ch2	2016-10-01T00:15:09.000+01:00	English and Welsh version of form CH2 and CH2 Notes have been updated to reflect new tax year changes.
child-benefit-claim-form-ch2	2016-04-06T05:00:05.000+01:00	English and Welsh version of form CH2, CH2 Notes and CH2 (CS) have been updated to reflect new tax year changes.
child-benefit-claim-form-ch2	2015-05-14T12:33:30.000+01:00	The CH3 address label on the CH2 has been adjusted so it's now on 1 page.
child-benefit-claim-form-ch2	2015-04-06T00:30:51.000+01:00	The 2015 to 2016 form has been added to this page.
child-benefit-claim-form-ch2	2014-10-01T10:00:23.000+01:00	New versions of forms Child Benefit claim form (CH2): print then complete and Child Benefit: getting your claim right (CH2 Notes).
child-benefit-claim-form-ch2	2014-04-11T01:00:00.000+01:00	Added translation
voter-registration-forms-paper-versions	2016-11-09T15:55:32.000+00:00	Updated new register to vote forms.
voter-registration-forms-paper-versions	2016-06-30T11:47:21.000+01:00	Updated new register to vote forms
voter-registration-forms-paper-versions	2016-03-23T15:16:42.000+00:00	Added new register to vote form - Welsh language version
voter-registration-forms-paper-versions	2015-09-09T13:13:56.000+01:00	Added Register to vote (living in Scotland) - large print
voter-registration-forms-paper-versions	2015-08-19T16:45:50.000+01:00	Updated large print version
voter-registration-forms-paper-versions	2015-07-31T10:09:45.000+01:00	Added Scottish paper forms
voter-registration-forms-paper-versions	2015-03-09T15:12:32.000+00:00	Added forms for people with no fixed or permanent address and for people to register anonymously to vote.
voter-registration-forms-paper-versions	2014-12-01T08:58:04.000+00:00	Added large print versions.
voter-registration-forms-paper-versions	2014-09-23T15:40:38.000+01:00	Added forms for people living in Scotland.
voter-registration-forms-paper-versions	2014-06-10T00:15:00.000+01:00	First published.
application-to-naturalise-as-a-british-citizen-form-an	2017-02-16T00:00:02.000+00:00	Updated AN form.
application-to-naturalise-as-a-british-citizen-form-an	2017-01-16T17:23:46.000+00:00	Updated AN guide and booklet.
application-to-naturalise-as-a-british-citizen-form-an	2016-09-21T09:57:58.000+01:00	Updated 'Booklet AN'.
application-to-naturalise-as-a-british-citizen-form-an	2016-08-09T10:32:53.000+01:00	We would like to remind applicants that the current version of the AN form is January 2016.
application-to-naturalise-as-a-british-citizen-form-an	2016-07-20T16:40:53.000+01:00	Updated AN Form.
application-to-naturalise-as-a-british-citizen-form-an	2016-06-14T10:38:13.000+01:00	Updated AN booklet and guide.
application-to-naturalise-as-a-british-citizen-form-an	2016-01-12T12:41:24.000+00:00	Updated form.
application-to-naturalise-as-a-british-citizen-form-an	2015-12-09T12:38:57.000+00:00	Updated guidance, December 2015.
application-to-naturalise-as-a-british-citizen-form-an	2015-11-18T18:03:30.000+00:00	Updated booklet, November 2015.
application-to-naturalise-as-a-british-citizen-form-an	2015-11-02T17:16:38.000+00:00	Updated AN form.
application-to-naturalise-as-a-british-citizen-form-an	2015-10-28T15:28:34.000+00:00	Updated AN guide and AN booklet.
application-to-naturalise-as-a-british-citizen-form-an	2015-07-14T15:04:36.000+01:00	Updated guidance
application-to-naturalise-as-a-british-citizen-form-an	2015-07-03T13:56:10.000+01:00	Updated guidance
application-to-naturalise-as-a-british-citizen-form-an	2015-06-04T12:31:10.000+01:00	Updated AN booklet.
application-to-naturalise-as-a-british-citizen-form-an	2015-05-29T11:32:21.000+01:00	Updated documents.
application-to-naturalise-as-a-british-citizen-form-an	2015-04-02T10:51:48.000+01:00	Updated document.
application-to-naturalise-as-a-british-citizen-form-an	2015-03-26T11:52:27.000+00:00	Updated documents
application-to-naturalise-as-a-british-citizen-form-an	2014-12-22T12:17:24.000+00:00	Updated AN booklet
application-to-naturalise-as-a-british-citizen-form-an	2014-12-09T17:21:09.000+00:00	Updated booklet on naturalisation
application-to-naturalise-as-a-british-citizen-form-an	2014-06-09T16:53:00.000+01:00	A new version of this form and guidance have been published for use on or after 2 June 2014. You can now tell us your email address to receive an update on the progress of your application.
application-to-naturalise-as-a-british-citizen-form-an	2014-04-02T12:45:30.000+01:00	Additional information on the Citizenship (Armed Forces) Act.
application-to-naturalise-as-a-british-citizen-form-an	2013-10-01T01:00:00.000+01:00	First published.
self-assessment-tax-return-sa100	2017-04-06T00:45:17.000+01:00	The 2016 to 2017 form and notes have been added to this page.
self-assessment-tax-return-sa100	2016-04-06T00:30:16.000+01:00	Rates, allowances and duties have been updated for the tax year 2016 to 2017.
self-assessment-tax-return-sa100	2015-07-13T11:44:51.000+01:00	Updates made to How to fill in your tax return (2015).
self-assessment-tax-return-sa100	2015-06-26T10:57:35.000+01:00	Tax return 2015 updated with information about how HMRC will make repayments to customers.
self-assessment-tax-return-sa100	2015-04-06T00:30:23.000+01:00	The 2015 to 2016 form has been added to this page.
self-assessment-tax-return-sa100	2014-11-21T08:40:29.000+00:00	The Self Assessment/PAYE return postal address has now changed for the returns to be received by HMRC. The new postal address has been added to send back completed returns.
self-assessment-tax-return-sa100	2014-07-07T02:01:00.000+01:00	Added translation
national-insurance-get-your-national-insurance-number-in-writing-ca5403	2015-12-22T08:05:08.000+00:00	An online service is now available.
national-insurance-get-your-national-insurance-number-in-writing-ca5403	2015-08-17T13:39:17.000+01:00	Amended postal address to: National Insurance Contributions and Employer Office, HM Revenue and Customs, BX9 1AN.
national-insurance-get-your-national-insurance-number-in-writing-ca5403	2014-04-09T01:00:00.000+01:00	Added translation
self-assessment-register-for-self-assessment-and-get-a-tax-return-sa1	2014-07-01T00:00:00.000+00:00	Published
apply-for-a-document-certifying-permanent-residence-or-permanent-residence-card-form-eea-pr	2017-04-12T09:57:57.000+01:00	Guidance updated. Examples of the type and level of evidence needed to make a valid application added.
apply-for-a-document-certifying-permanent-residence-or-permanent-residence-card-form-eea-pr	2016-12-30T13:04:03.000+00:00	Added link to European passport return service.
apply-for-a-document-certifying-permanent-residence-or-permanent-residence-card-form-eea-pr	2016-03-18T00:00:15.000+00:00	Updated form and guidance for use on or after 18 March.
apply-for-a-document-certifying-permanent-residence-or-permanent-residence-card-form-eea-pr	2015-07-20T00:00:15.000+01:00	Updated form and guidance for use on or after 20 July 2015.
apply-for-a-document-certifying-permanent-residence-or-permanent-residence-card-form-eea-pr	2015-03-31T00:00:07.000+01:00	Updated information.
apply-for-a-document-certifying-permanent-residence-or-permanent-residence-card-form-eea-pr	2015-01-30T00:00:00.000+00:00	First published.
paye-starter-checklist	2016-04-04T14:11:18.000+01:00	Printable alternative of PAYE: starter checklist for Welsh and English versions have been added to this page.
paye-starter-checklist	2016-03-08T14:40:31.000+00:00	The Starter Checklist has been updated to reflect new tax year changes and include Student Loan information.
paye-starter-checklist	2015-04-08T13:17:48.000+01:00	Clarification added on how to use the form.
paye-starter-checklist	2015-02-17T15:11:09.000+00:00	Welsh form and translation added.
paye-starter-checklist	2014-04-15T01:00:00.000+01:00	First published.
make-a-lasting-power-of-attorney	2017-04-01T00:00:09.000+01:00	Added translation and changed fee levels on documents
make-a-lasting-power-of-attorney	2016-07-05T09:59:47.000+01:00	The title of the page has been amended to make it clear that these are the paper forms to create a lasting power of attorney, as opposed to the title for the digital service.
make-a-lasting-power-of-attorney	2015-11-24T10:34:21.000+00:00	Added instructions for opening zip files and simplified some attachment names.
make-a-lasting-power-of-attorney	2015-11-23T12:25:38.000+00:00	Added large print LPA pack and instructions for opening zip files.
make-a-lasting-power-of-attorney	2015-09-07T14:58:09.000+01:00	Updated form guidance LP12
make-a-lasting-power-of-attorney	2015-07-16T15:43:25.000+01:00	LP12 guide now includes OPG's information charter.
make-a-lasting-power-of-attorney	2015-07-02T19:43:03.000+01:00	Link added to new Welsh LPA page.
make-a-lasting-power-of-attorney	2015-07-01T00:15:24.000+01:00	Lasting power of attorney (LPA) forms changed on 1 July 2015.There is now just 1 paper form to make and register an LPA instead of 2.
make-a-lasting-power-of-attorney	2015-01-21T10:29:48.000+00:00	Added link to Welsh page.
make-a-lasting-power-of-attorney	2014-12-09T09:40:30.000+00:00	New versions of PFA pack, HW pack, form LPA 111 and LPA112
make-a-lasting-power-of-attorney	2013-10-01T00:00:03.000+01:00	Replace zip packs, including LPA120 form, to reflect new power of attorney application fees from 1 Otober 2013.
make-a-lasting-power-of-attorney	2013-07-09T06:40:34.000+01:00	Uploaded new individual forms
make-a-lasting-power-of-attorney	2013-07-08T17:32:34.000+01:00	Individual documents uploaded in addition to ZIP packs
make-a-lasting-power-of-attorney	2013-06-25T12:16:00.000+01:00	First published.
income-tax-tax-relief-for-expenses-of-employment-p87	2016-03-03T13:11:48.000+00:00	An online service is now available.
income-tax-tax-relief-for-expenses-of-employment-p87	2014-07-21T01:00:00.000+01:00	First published.
statutory-sick-pay-employees-statement-of-sickness-sc2	2015-04-06T00:00:08.000+01:00	An updated form SC2 for employees who have been sick for 4 or more days in a row and need to claim Statutory Sick Pay (SSP) from your employer has been published.
statutory-sick-pay-employees-statement-of-sickness-sc2	2014-07-10T01:00:00.000+01:00	Added translation
application-to-transfer-or-retain-a-vehicle-registration-number	2017-03-15T16:01:19.000+00:00	Updated version
application-to-transfer-or-retain-a-vehicle-registration-number	2016-11-17T16:57:29.000+00:00	Added translation
application-to-transfer-or-retain-a-vehicle-registration-number	2015-05-27T08:39:54.000+01:00	Links added to our new online services.
application-to-transfer-or-retain-a-vehicle-registration-number	2015-03-18T10:52:37.000+00:00	Update to the V317W.
application-to-transfer-or-retain-a-vehicle-registration-number	2015-03-06T12:06:49.000+00:00	Updates to section B and C and new section E ( Conditions on taxing a vehicle) added in guidance notes.
application-to-transfer-or-retain-a-vehicle-registration-number	2014-10-01T00:30:39.000+01:00	Amended document to include abolition of the tax disc changes.
application-to-transfer-or-retain-a-vehicle-registration-number	2014-07-22T07:21:16.000+01:00	Update due to centralisation of Northern Ireland vehicle services
application-to-transfer-or-retain-a-vehicle-registration-number	2013-06-28T08:50:38.000+01:00	Updates to the form due to LO office closures.
application-to-transfer-or-retain-a-vehicle-registration-number	2013-06-13T15:18:51.000+01:00	Reverted back to previous PDF version as LO changes are not due to go live until end of June.
application-to-transfer-or-retain-a-vehicle-registration-number	2013-06-11T11:06:27.000+01:00	Updates are due to LO closures and the personalised registration work centralised at Swansea.
application-to-transfer-or-retain-a-vehicle-registration-number	2012-02-01T00:00:00.000+00:00	First published.
application-to-register-child-under-18-as-british-citizen-form-mn1	2017-01-13T11:45:23.000+00:00	Updated form and guidance.
application-to-register-child-under-18-as-british-citizen-form-mn1	2016-04-12T15:31:49.000+01:00	Updated form.
application-to-register-child-under-18-as-british-citizen-form-mn1	2015-12-09T12:14:26.000+00:00	Updated guidance.
application-to-register-child-under-18-as-british-citizen-form-mn1	2015-09-17T11:18:46.000+01:00	Updated guide.
application-to-register-child-under-18-as-british-citizen-form-mn1	2015-06-24T10:37:00.000+01:00	Updated form and guide.
application-to-register-child-under-18-as-british-citizen-form-mn1	2015-06-01T14:42:20.000+01:00	Updated guide.
application-to-register-child-under-18-as-british-citizen-form-mn1	2015-03-26T11:52:29.000+00:00	Updated guidance and form
application-to-register-child-under-18-as-british-citizen-form-mn1	2014-06-09T16:51:28.000+01:00	A new version of this form and guidance have been published for use on or after 2 June 2014. You can now tell us your email address to receive an update on the progress of your application.
application-to-register-child-under-18-as-british-citizen-form-mn1	2014-02-06T16:23:31.000+00:00	Guide MN1 updated 6 February 2014
application-to-register-child-under-18-as-british-citizen-form-mn1	2013-09-01T01:00:00.000+01:00	First published.
attendance-allowance-claim-form	2017-05-12T07:56:49.000+01:00	Added updated versions of Attendance Allowance claim forms. Removed reference to AA1 and changed to AA1A.
attendance-allowance-claim-form	2015-07-20T16:27:16.000+01:00	Added revised AA1A interactive and print forms.
attendance-allowance-claim-form	2014-02-05T11:48:42.000+00:00	Added revised forms with new contact phone numbers.
attendance-allowance-claim-form	2014-01-16T12:19:05.000+00:00	Published January 2014 versions of the Attendance Allowance claim form.
attendance-allowance-claim-form	2013-04-01T00:00:00.000+01:00	First published.
paye-end-of-year-expenses-and-benefits-p11d	2017-04-06T00:15:11.000+01:00	English and Welsh versions of form P11D have been published for 2016 to 2017 tax year.
paye-end-of-year-expenses-and-benefits-p11d	2016-04-06T00:15:14.000+01:00	English and Welsh versions of the P11D for the 2015 to 2016 tax year are now available.
paye-end-of-year-expenses-and-benefits-p11d	2015-05-21T14:23:25.000+01:00	Box B has a change to the '90 day' rule in regards to recouping tax on notional payments.
paye-end-of-year-expenses-and-benefits-p11d	2015-04-06T00:15:01.000+01:00	Form P11d for employers to report end-of-year expenses and benefits for 2014 to 2015 has been published.
paye-end-of-year-expenses-and-benefits-p11d	2014-05-01T01:00:00.000+01:00	Added translation
income-tax-leaving-the-uk-getting-your-tax-right-p85	2017-05-15T13:24:17.000+01:00	The English and Welsh print and post forms have been updated.
income-tax-leaving-the-uk-getting-your-tax-right-p85	2015-11-30T16:24:33.000+00:00	An online service is now available.
income-tax-leaving-the-uk-getting-your-tax-right-p85	2013-01-01T00:01:00.000+00:00	Added translation
national-insurance-application-for-specified-adult-childcare-credits-ca9176	2015-04-08T09:01:13.000+01:00	Welsh version of form CA9176 added to this page.
national-insurance-application-for-specified-adult-childcare-credits-ca9176	2014-04-30T01:00:00.000+01:00	First published.
change-the-register-ap1	2016-11-03T08:37:22.000+00:00	Welsh version of checklist added.
change-the-register-ap1	2016-10-07T11:57:16.000+01:00	Checklist and video: applications for registered land added.
change-the-register-ap1	2016-01-11T06:00:13.000+00:00	We have added a side note to panel 7 as a result of a change in our procedures. From 11 January 2016 we will change how we send warning of cancellation letters and what they contain.
change-the-register-ap1	2015-08-03T06:00:08.000+01:00	Advice as to the completion of the form has been added
change-the-register-ap1	2012-10-24T00:00:00.000+01:00	Added translation
strike-off-a-company-from-the-register-ds01	2015-05-26T07:32:41.000+01:00	DS01 updated to version 7
strike-off-a-company-from-the-register-ds01	2015-01-20T12:57:55.000+00:00	Checklist guidance added to the page
strike-off-a-company-from-the-register-ds01	2014-09-19T14:38:00.000+01:00	First published.
application-to-extend-stay-in-the-uk-as-a-partner-form-flrm	2017-04-06T00:00:07.000+01:00	Updated application form and guidance for use on or after 6 April 2017.
application-to-extend-stay-in-the-uk-as-a-partner-form-flrm	2016-12-21T00:00:05.000+00:00	Updated form and guidance for use on or after 21 December.
application-to-extend-stay-in-the-uk-as-a-partner-form-flrm	2016-11-25T14:36:39.000+00:00	Updated guidance.
application-to-extend-stay-in-the-uk-as-a-partner-form-flrm	2016-11-24T00:00:14.000+00:00	Updated form for use on or after 24 November.
application-to-extend-stay-in-the-uk-as-a-partner-form-flrm	2016-04-18T00:00:00.000+01:00	Updated form for use on or after 8 April.
application-to-extend-stay-in-the-uk-as-a-partner-form-flrm	2016-04-06T00:00:22.000+01:00	Updated application form for use on or after 6 April 2016.
application-to-extend-stay-in-the-uk-as-a-partner-form-flrm	2016-03-22T09:38:46.000+00:00	Updated form for use on or after 18 March.
application-to-extend-stay-in-the-uk-as-a-partner-form-flrm	2015-11-19T00:00:25.000+00:00	Updated guidance and application form for use on or after 19th November.
application-to-extend-stay-in-the-uk-as-a-partner-form-flrm	2015-04-06T00:15:37.000+01:00	New version published for use on or after 6 April 2015.
application-to-extend-stay-in-the-uk-as-a-partner-form-flrm	2014-11-06T00:00:16.000+00:00	New versions published for use on or after 6 November 2014.
application-to-extend-stay-in-the-uk-as-a-partner-form-flrm	2014-08-12T15:25:14.000+01:00	Updated guidance.
application-to-extend-stay-in-the-uk-as-a-partner-form-flrm	2014-07-28T00:00:12.000+01:00	Updated FLR(M) application form and guidance, 28/07/2014.
application-to-extend-stay-in-the-uk-as-a-partner-form-flrm	2014-04-06T00:18:40.000+01:00	New form published for use on and after 6 April 2014.
application-to-extend-stay-in-the-uk-as-a-partner-form-flrm	2013-10-01T01:00:00.000+01:00	First published.
inheritance-tax-return-of-estate-information-iht205-2011	2017-03-06T14:50:29.000+00:00	New customers can now trial our online service for Inheritance Tax reporting.
inheritance-tax-return-of-estate-information-iht205-2011	2015-10-28T13:54:24.000+00:00	From November 2015 if you are already registered to use SA Online, you may be able to use our new Inheritance Tax Online Service instead of filling in form IHT205.
inheritance-tax-return-of-estate-information-iht205-2011	2015-09-10T10:46:43.000+01:00	Updated forms IHT205 (2011) and IHT 206 (2011) have been added to the page.
inheritance-tax-return-of-estate-information-iht205-2011	2014-04-04T01:00:00.000+01:00	First published.
tax-agents-and-advisers-authorising-your-agent-64-8	2017-02-27T16:05:09.000+00:00	Under '5 Where to send this form' in bullet point 3 the words 'or an expatriate' and 'or the Manchester expat team' has been deleted. The Manchester Expat Team no longer deal with 64-8 forms.
tax-agents-and-advisers-authorising-your-agent-64-8	2016-01-06T13:33:38.000+00:00	The Authorising your agent (64-8) attachment has been updated and replaced.
tax-agents-and-advisers-authorising-your-agent-64-8	2014-04-04T01:00:00.000+01:00	Added translation
v890-statutory-off-road-notification-sorn	2016-11-15T10:08:21.000+00:00	Added translation
v890-statutory-off-road-notification-sorn	2016-08-16T16:23:32.000+01:00	PDFs updated.
v890-statutory-off-road-notification-sorn	2016-01-05T10:06:59.000+00:00	New version of the Welsh V890.
v890-statutory-off-road-notification-sorn	2015-07-03T09:11:47.000+01:00	Latest version uploaded
v890-statutory-off-road-notification-sorn	2014-10-01T14:21:00.000+01:00	New version of both V890 &V890W published
v890-statutory-off-road-notification-sorn	2014-07-22T07:22:00.000+01:00	Update due to centralisation of Northern Ireland vehicle services
v890-statutory-off-road-notification-sorn	2013-12-16T14:52:12.000+00:00	New version of the V890W added.
v890-statutory-off-road-notification-sorn	2013-12-16T08:50:27.000+00:00	New version of the V890 added.
v890-statutory-off-road-notification-sorn	2012-09-09T08:25:00.000+01:00	First published.
child-benefit-change-of-family-circumstances	2016-08-22T11:55:17.000+01:00	The email versions of this form has been removed.
child-benefit-change-of-family-circumstances	2015-11-30T16:22:00.000+00:00	First published.
employment-and-support-allowance-claim-form	2017-03-02T15:59:53.000+00:00	Published revised ESA claim form you can print and fill in with a pen – English and Welsh.
employment-and-support-allowance-claim-form	2017-02-28T09:30:26.000+00:00	Published revised ESA claim form you can download, fill in on screen, save – and then print.
employment-and-support-allowance-claim-form	2015-03-31T15:15:29.000+01:00	Expanded notes section to inlcude advice for claimants who have claimed ESA before.
employment-and-support-allowance-claim-form	2014-01-13T15:18:57.000+00:00	Added updated versions - Oct 2013.
employment-and-support-allowance-claim-form	2013-04-01T00:00:00.000+01:00	First published.
income-tax-claiming-tax-back-when-you-have-stopped-working-p50	2017-01-05T13:58:04.000+00:00	Clarification has been added to explain the form is to be used by people working within the UK.
income-tax-claiming-tax-back-when-you-have-stopped-working-p50	2015-11-30T16:25:51.000+00:00	An online service is now available.
income-tax-claiming-tax-back-when-you-have-stopped-working-p50	2015-07-13T15:56:48.000+01:00	New print and complete form added.
income-tax-claiming-tax-back-when-you-have-stopped-working-p50	2015-05-22T15:04:00.000+01:00	Welsh version of form P50Z added to this page.
income-tax-claiming-tax-back-when-you-have-stopped-working-p50	2015-04-06T00:15:48.000+01:00	Form P50Z added to claim refund on flexible access pension payment.
income-tax-claiming-tax-back-when-you-have-stopped-working-p50	2015-01-21T15:13:36.000+00:00	Added translation
income-tax-claiming-tax-back-when-you-have-stopped-working-p50	2014-07-01T01:00:00.000+01:00	First published.
maternity-allowance-claim-form	2016-05-04T11:41:56.000+01:00	Replaced all 3 versions with March 2016 editions.
maternity-allowance-claim-form	2014-10-10T13:03:58.000+01:00	Replaced the interactive and print versions of the form with October 2014 editions.
maternity-allowance-claim-form	2013-10-01T00:00:00.000+01:00	First published.
application-for-uk-visa-for-family-settlement-form-vaf4a	2016-03-02T11:43:46.000+00:00	Updated information.
application-for-uk-visa-for-family-settlement-form-vaf4a	2013-12-01T00:00:00.000+00:00	First published.
apply-for-a-registration-certificate-as-a-qualified-person-form-eea-qp	2017-03-21T10:54:21.000+00:00	Updated application form.
apply-for-a-registration-certificate-as-a-qualified-person-form-eea-qp	2017-02-06T00:00:09.000+00:00	Updated form for use on or after 6 February 2017.
apply-for-a-registration-certificate-as-a-qualified-person-form-eea-qp	2016-12-30T13:00:51.000+00:00	Added link to European passport return service.
apply-for-a-registration-certificate-as-a-qualified-person-form-eea-qp	2016-03-18T00:00:16.000+00:00	Updated form and guidance for use on or after 18 March.
apply-for-a-registration-certificate-as-a-qualified-person-form-eea-qp	2015-07-20T00:00:15.000+01:00	Updated form and guidance for use on or after 20 July 2015.
apply-for-a-registration-certificate-as-a-qualified-person-form-eea-qp	2015-03-31T00:00:07.000+01:00	Updated information.
apply-for-a-registration-certificate-as-a-qualified-person-form-eea-qp	2015-01-30T00:00:00.000+00:00	First published.
application-for-transfer-of-residence-tor-relief-tor01	2017-05-05T15:52:31.000+01:00	Form updated as the conditions for applying for a Transfer of Residence have changed.
application-for-transfer-of-residence-tor-relief-tor01	2016-12-07T12:54:00.000+00:00	First published.
disability-living-allowance-for-children-claim-form	2016-06-29T09:30:02.000+01:00	Published update of the DLA for children claim forms for June 2016.
disability-living-allowance-for-children-claim-form	2014-02-05T11:48:08.000+00:00	Added revised forms with new contact phone numbers.
